{
  "$schema": "https://json-schema.org/draft/2020-12/schema",
  "$id": "https://opennod.ai/schema/nod/v0.2.json",
  "title": "Nod Protocol Manifest v0.2",
  "description": "JSON Schema for the lean v0.2 nod core manifest. Core describes the merchant's identity, classification (NAICS + GBP), addresses, contact info, and hours — the parts universal to every business. Agent-commerce concerns (discovery, transactions, information, support, agent policies) live in the ai.opennod.agent-commerce extension. Industry-specific Schema.org properties live in the ai.opennod.schema-org-extension extension. Narrative/voice fields live in the ai.opennod.merchant-voice extension. See spec/nod-protocol-v0.2.md.",
  "type": "object",
  "required": ["nod_version", "generated_at", "business"],
  "additionalProperties": true,
  "properties": {
    "$schema": {
      "type": "string",
      "format": "uri",
      "description": "URL of the JSON Schema for validation."
    },
    "nod_version": {
      "type": "string",
      "const": "0.2",
      "description": "Protocol version. Must match a published version. v0.2 is a breaking change from v0.1; see CHANGELOG.md."
    },
    "generated_at": {
      "type": "string",
      "format": "date-time",
      "description": "ISO 8601 datetime of when this manifest was last generated/updated."
    },
    "business": { "$ref": "#/$defs/business" },
    "extensions": {
      "type": "object",
      "description": "Reverse-domain-namespaced extensions. The agent-commerce surface lives at extensions[\"ai.opennod.agent-commerce\"] and is required for any merchant intending to be transacted with by agents.",
      "additionalProperties": { "type": "object" }
    }
  },
  "$defs": {
    "business": {
      "type": "object",
      "description": "Core business identity, classification, and basic metadata. Universal across all businesses.",
      "required": ["name", "naics_code", "gbp_primary_category", "url"],
      "additionalProperties": true,
      "properties": {
        "name": {
          "type": "string",
          "minLength": 1,
          "description": "Business name as it appears to customers."
        },
        "legal_name": {
          "type": "string",
          "description": "Legal entity name. Often differs from `name`."
        },
        "dba_names": {
          "type": "array",
          "items": { "type": "string", "minLength": 1 },
          "description": "Doing-business-as names this entity also operates under."
        },
        "description": {
          "type": "string",
          "description": "Plain-language description of what the business does."
        },
        "naics_code": {
          "type": "string",
          "pattern": "^(\\d{2,6}|31-33|44-45|48-49)$",
          "description": "Primary NAICS 2022 industry code. Required. Use the most specific applicable code (typically 6-digit national-industry). The three published range sectors (31-33 Manufacturing, 44-45 Retail Trade, 48-49 Transportation and Warehousing) are valid as written. Pattern validation only — semantic validation against taxonomy/naics-2022.json is the consumer's responsibility."
        },
        "gbp_primary_category": {
          "type": "string",
          "minLength": 1,
          "description": "Primary Google Business Profile category. Required. v0.2 accepts free string with no enum constraint pending an authoritative GBP category list (see taxonomy/gbp-categories.README.md). A future protocol revision may tighten this to enum-validated against taxonomy/gbp-categories.json."
        },
        "gbp_secondary_categories": {
          "type": "array",
          "items": { "type": "string", "minLength": 1 },
          "description": "Additional GBP categories, in priority order. Same free-string semantics as gbp_primary_category for v0.2."
        },
        "categories": {
          "type": "array",
          "items": { "type": "string" },
          "description": "Free-form business category tags. Distinct from naics_code (industry classification) and gbp_primary_category (Google's taxonomy)."
        },
        "url": {
          "type": "string",
          "format": "uri",
          "description": "Primary business URL — must match the serving domain."
        },
        "logo": {
          "type": "string",
          "format": "uri",
          "description": "URL to a business logo image."
        },
        "founded": {
          "type": "string",
          "description": "Year (or full date) the business was founded."
        },
        "locations": {
          "type": "array",
          "items": { "$ref": "#/$defs/location" },
          "description": "Physical and/or virtual business locations."
        },
        "contacts": { "$ref": "#/$defs/contacts" },
        "social": {
          "type": "object",
          "additionalProperties": { "type": "string", "format": "uri" },
          "description": "Social media profile URLs keyed by network."
        },
        "schema_org": {
          "type": "string",
          "format": "uri",
          "description": "URL to a Schema.org JSON-LD document for this business. Distinct from extensions[\"ai.opennod.schema-org-extension\"], which carries inline industry-specific Schema.org properties."
        },
        "identifiers": {
          "type": "object",
          "description": "Business identifiers (DUNS, EIN, LEI, etc.).",
          "additionalProperties": { "type": "string" },
          "properties": {
            "duns": { "type": "string" },
            "ein": { "type": "string" },
            "lei": { "type": "string" }
          }
        }
      }
    },
    "location": {
      "type": "object",
      "additionalProperties": true,
      "properties": {
        "type": {
          "type": "string",
          "enum": ["physical", "virtual", "headquarters", "warehouse", "office"]
        },
        "name": { "type": "string" },
        "address": { "$ref": "#/$defs/address" },
        "coordinates": {
          "type": "object",
          "required": ["latitude", "longitude"],
          "properties": {
            "latitude": { "type": "number", "minimum": -90, "maximum": 90 },
            "longitude": { "type": "number", "minimum": -180, "maximum": 180 }
          }
        },
        "hours": { "$ref": "#/$defs/hours" },
        "phone": { "type": "string" },
        "email": { "type": "string", "format": "email" }
      }
    },
    "address": {
      "type": "object",
      "additionalProperties": true,
      "properties": {
        "street": { "type": "string" },
        "city": { "type": "string" },
        "state": { "type": "string" },
        "postal_code": { "type": "string" },
        "country": {
          "type": "string",
          "description": "ISO 3166-1 alpha-2 country code."
        }
      }
    },
    "hours": {
      "type": "object",
      "additionalProperties": true,
      "properties": {
        "timezone": {
          "type": "string",
          "description": "IANA timezone identifier."
        },
        "regular": {
          "type": "object",
          "additionalProperties": false,
          "properties": {
            "monday": { "$ref": "#/$defs/day_hours" },
            "tuesday": { "$ref": "#/$defs/day_hours" },
            "wednesday": { "$ref": "#/$defs/day_hours" },
            "thursday": { "$ref": "#/$defs/day_hours" },
            "friday": { "$ref": "#/$defs/day_hours" },
            "saturday": { "$ref": "#/$defs/day_hours" },
            "sunday": { "$ref": "#/$defs/day_hours" }
          }
        },
        "exceptions": {
          "type": "array",
          "items": {
            "type": "object",
            "required": ["date", "status"],
            "properties": {
              "date": { "type": "string", "format": "date" },
              "status": { "type": "string", "enum": ["closed", "modified"] },
              "reason": { "type": "string" },
              "open": { "type": "string" },
              "close": { "type": "string" }
            }
          }
        }
      }
    },
    "day_hours": {
      "oneOf": [
        {
          "type": "object",
          "required": ["open", "close"],
          "properties": {
            "open": { "type": "string", "pattern": "^([01]\\d|2[0-3]):[0-5]\\d$" },
            "close": { "type": "string", "pattern": "^([01]\\d|2[0-3]):[0-5]\\d$" }
          }
        },
        {
          "type": "array",
          "description": "Split hours (e.g. lunch and dinner service).",
          "items": {
            "type": "object",
            "required": ["open", "close"],
            "properties": {
              "open": { "type": "string", "pattern": "^([01]\\d|2[0-3]):[0-5]\\d$" },
              "close": { "type": "string", "pattern": "^([01]\\d|2[0-3]):[0-5]\\d$" },
              "label": { "type": "string" }
            }
          }
        },
        {
          "type": "object",
          "required": ["status"],
          "properties": {
            "status": { "const": "closed" }
          }
        },
        { "const": "closed" }
      ]
    },
    "contacts": {
      "type": "object",
      "description": "Contact channels keyed by purpose (e.g. 'general', 'support', 'press').",
      "additionalProperties": {
        "type": "object",
        "additionalProperties": true,
        "properties": {
          "email": { "type": "string", "format": "email" },
          "phone": { "type": "string" },
          "url": { "type": "string", "format": "uri" }
        }
      }
    }
  }
}
