{
  "$schema": "https://opennod.ai/schema/nod/v0.2.json",
  "nod_version": "0.2",
  "generated_at": "2026-03-23T12:00:00Z",
  "business": {
    "name": "The Grand Portland",
    "description": "Boutique luxury hotel in Portland's historic Pearl District with 92 rooms and rooftop dining",
    "url": "https://thegrandportland.com",
    "locations": [
      {
        "type": "physical",
        "address": {
          "street": "215 NW 12th Ave",
          "city": "Portland",
          "state": "OR",
          "postal_code": "97209",
          "country": "US"
        },
        "hours": {
          "timezone": "America/Los_Angeles",
          "regular": {
            "monday": {
              "open": "00:00",
              "close": "23:59"
            },
            "tuesday": {
              "open": "00:00",
              "close": "23:59"
            },
            "wednesday": {
              "open": "00:00",
              "close": "23:59"
            },
            "thursday": {
              "open": "00:00",
              "close": "23:59"
            },
            "friday": {
              "open": "00:00",
              "close": "23:59"
            },
            "saturday": {
              "open": "00:00",
              "close": "23:59"
            },
            "sunday": {
              "open": "00:00",
              "close": "23:59"
            }
          },
          "notes": "Front desk open 24/7"
        },
        "phone": "+1-503-555-0500"
      }
    ],
    "contacts": {
      "general": {
        "email": "info@thegrandportland.com",
        "phone": "+1-503-555-0500"
      },
      "reservations": {
        "email": "reservations@thegrandportland.com",
        "phone": "+1-503-555-0501"
      }
    },
    "naics_code": "721110",
    "gbp_primary_category": "Hotel"
  },
  "extensions": {
    "ai.opennod.agent-commerce": {
      "policies": {
        "human_fallback": {
          "url": "https://thegrandportland.com",
          "description": "Visit our website or call to book rooms, check availability, or inquire about events"
        }
      }
    }
  }
}
