{
  "$schema": "https://opennod.ai/schema/nod/v0.2.json",
  "nod_version": "0.2",
  "generated_at": "2026-03-23T12:00:00Z",
  "business": {
    "name": "Sakura Sushi",
    "naics_code": "722511",
    "gbp_primary_category": "Sushi Restaurant",
    "url": "https://sakurasushi.com",
    "description": "Authentic Japanese sushi and omakase dining in downtown Seattle",
    "locations": [
      {
        "type": "physical",
        "address": {
          "street": "742 Pike St",
          "city": "Seattle",
          "state": "WA",
          "postal_code": "98101",
          "country": "US"
        },
        "hours": {
          "timezone": "America/Los_Angeles",
          "regular": {
            "monday": {
              "status": "closed"
            },
            "tuesday": {
              "open": "11:30",
              "close": "14:00"
            },
            "wednesday": {
              "open": "11:30",
              "close": "14:00"
            },
            "thursday": {
              "open": "11:30",
              "close": "14:00"
            },
            "friday": {
              "open": "11:30",
              "close": "14:30"
            },
            "saturday": {
              "open": "12:00",
              "close": "15:00"
            },
            "sunday": {
              "open": "12:00",
              "close": "14:00"
            }
          },
          "notes": "Dinner service Tuesday-Saturday 17:00-22:00, Sunday 17:00-21:00"
        },
        "phone": "+1-206-555-0400"
      }
    ],
    "contacts": {
      "general": {
        "email": "info@sakurasushi.com",
        "phone": "+1-206-555-0400"
      }
    }
  },
  "extensions": {
    "ai.opennod.agent-commerce": {
      "policies": {
        "human_fallback": {
          "url": "https://sakurasushi.com",
          "description": "Visit our website or call to make reservations and view our menu"
        }
      }
    }
  }
}
